{
  "version": "1.0.0",
  "lastUpdated": "2026-03-29T00:00:00Z",
  "categories": [
    {
      "id": "dotnet-core",
      "name": ".NET Core & Fundamentals",
      "icon": "🔷",
      "description": "C# syntax, LINQ, async/await, dependency injection"
    },
    {
      "id": "aspnet-web",
      "name": "ASP.NET & Web APIs",
      "icon": "🌐",
      "description": "REST APIs, Minimal APIs, Blazor, SignalR"
    },
    {
      "id": "ef-data",
      "name": "Entity Framework & Data",
      "icon": "🗄️",
      "description": "EF Core, migrations, LINQ to SQL, Dapper"
    },
    {
      "id": "testing",
      "name": "Testing & Quality",
      "icon": "🧪",
      "description": "xUnit, NUnit, MSTest, Moq, FluentAssertions"
    },
    {
      "id": "msbuild-build",
      "name": "MSBuild & Build System",
      "icon": "🔧",
      "description": "Project files, build optimization, NuGet packages"
    },
    {
      "id": "dotnet-nuget",
      "name": "NuGet & Package Management",
      "icon": "📦",
      "description": "NuGet packages, dependency management, versioning"
    },
    {
      "id": "dotnet-upgrade",
      "name": "Migration & Upgrade",
      "icon": "⬆️",
      "description": "Framework migration, .NET 6→8→10, API compat"
    },
    {
      "id": "dotnet-maui",
      "name": ".NET MAUI & Mobile",
      "icon": "📱",
      "description": "Cross-platform UI, XAML, mobile development"
    },
    {
      "id": "dotnet-ai",
      "name": "AI & ML with .NET",
      "icon": "🤖",
      "description": "ML.NET, Semantic Kernel, LLM integration, MCP"
    },
    {
      "id": "dotnet-diag",
      "name": "Diagnostics & Performance",
      "icon": "🔍",
      "description": "Performance investigations, debugging, incident analysis"
    },
    {
      "id": "dotnet-template",
      "name": "Template Engine & Scaffolding",
      "icon": "🏗️",
      "description": "Template discovery, project scaffolding, template authoring"
    },
    {
      "id": "security",
      "name": "Security & Auth",
      "icon": "🔒",
      "description": "Identity, OAuth, OWASP, secure coding"
    }
  ],
  "skills": [
    {
      "id": "dotnet-dependency-injection",
      "name": ".NET Dependency Injection",
      "description": "Master dependency injection patterns in .NET Core applications, including service lifetimes (Transient, Scoped, Singleton), constructor injection, and best practices for building loosely coupled, testable applications with Microsoft.Extensions.DependencyInjection.",
      "shortDescription": "Learn DI patterns, service lifetimes, and IoC container usage",
      "category": "dotnet-core",
      "author": "dotnet-community",
      "triggers": ["dependency injection", "DI", "IoC", "service registration"],
      "complexity": "intermediate",
      "featured": true,
      "license": "MIT",
      "platforms": ["windows", "macos", "linux"],
      "tags": ["di", "ioc", "dependency-injection", "services", "container"],
      "source": {
        "repo": "https://github.com/serkutYILDIRIM/dotnet-skills-hub",
        "repoName": "serkutYILDIRIM/dotnet-skills-hub",
        "path": "skills/dotnet-dependency-injection",
        "skillFile": "SKILL.md",
        "branch": "main"
      }
    },
    {
      "id": "csharp-async-await-patterns",
      "name": "C# Async/Await Patterns",
      "description": "Understand asynchronous programming in C# with async/await keywords, Task and ValueTask patterns, ConfigureAwait usage, handling async exceptions, cancellation tokens, and avoiding common pitfalls like async void and deadlocks.",
      "shortDescription": "Master async/await, Task patterns, and async best practices",
      "category": "dotnet-core",
      "author": "dotnet-community",
      "triggers": ["async", "await", "asynchronous", "Task"],
      "complexity": "intermediate",
      "featured": true,
      "license": "MIT",
      "platforms": ["windows", "macos", "linux"],
      "tags": ["async", "await", "task", "asynchronous", "concurrency"],
      "source": {
        "repo": "https://github.com/serkutYILDIRIM/dotnet-skills-hub",
        "repoName": "serkutYILDIRIM/dotnet-skills-hub",
        "path": "skills/csharp-async-await-patterns",
        "skillFile": "SKILL.md",
        "branch": "main"
      }
    },
    {
      "id": "linq-query-optimization",
      "name": "LINQ Query Optimization",
      "description": "Optimize LINQ queries for performance by understanding deferred execution, avoiding unnecessary enumerations, using appropriate query operators, leveraging indexed collections, and recognizing when to use LINQ to Objects vs. LINQ to SQL patterns.",
      "shortDescription": "Optimize LINQ queries and understand execution patterns",
      "category": "dotnet-core",
      "author": "dotnet-community",
      "triggers": ["LINQ", "query optimization", "performance", "IEnumerable"],
      "complexity": "advanced",
      "license": "MIT",
      "platforms": ["windows", "macos", "linux"],
      "tags": ["linq", "query", "optimization", "performance", "ienumerable"],
      "source": {
        "repo": "https://github.com/serkutYILDIRIM/dotnet-skills-hub",
        "repoName": "serkutYILDIRIM/dotnet-skills-hub",
        "path": "skills/linq-query-optimization",
        "skillFile": "SKILL.md",
        "branch": "main"
      }
    },
    {
      "id": "aspnet-minimal-api",
      "name": "ASP.NET Minimal APIs",
      "description": "Build lightweight, high-performance web APIs using ASP.NET Core Minimal APIs. Learn endpoint routing, parameter binding, dependency injection in endpoints, validation, OpenAPI integration, and when to choose Minimal APIs over traditional controllers.",
      "shortDescription": "Create lightweight web APIs with Minimal API approach",
      "category": "aspnet-web",
      "author": "dotnet-community",
      "triggers": ["minimal api", "web api", "endpoint", "MapGet"],
      "complexity": "beginner",
      "featured": true,
      "license": "MIT",
      "platforms": ["windows", "macos", "linux"],
      "tags": ["minimal-api", "web-api", "aspnet", "endpoints", "rest"],
      "source": {
        "repo": "https://github.com/serkutYILDIRIM/dotnet-skills-hub",
        "repoName": "serkutYILDIRIM/dotnet-skills-hub",
        "path": "skills/aspnet-minimal-api",
        "skillFile": "SKILL.md",
        "branch": "main"
      }
    },
    {
      "id": "blazor-component-patterns",
      "name": "Blazor Component Patterns",
      "description": "Master Blazor component development with patterns for state management, component parameters, event callbacks, cascading values, component lifecycle methods, and building reusable UI components for both Blazor Server and WebAssembly applications.",
      "shortDescription": "Build reusable Blazor components with proper patterns",
      "category": "aspnet-web",
      "author": "dotnet-community",
      "triggers": ["blazor", "component", "razor", "WebAssembly"],
      "complexity": "intermediate",
      "license": "MIT",
      "platforms": ["windows", "macos", "linux"],
      "tags": ["blazor", "components", "razor", "webassembly", "ui"],
      "source": {
        "repo": "https://github.com/serkutYILDIRIM/dotnet-skills-hub",
        "repoName": "serkutYILDIRIM/dotnet-skills-hub",
        "path": "skills/blazor-component-patterns",
        "skillFile": "SKILL.md",
        "branch": "main"
      }
    },
    {
      "id": "signalr-realtime-setup",
      "name": "SignalR Real-time Setup",
      "description": "Implement real-time communication in .NET applications using SignalR. Learn hub configuration, connection management, client-server messaging, group management, authentication, scaling with Redis backplane, and troubleshooting connection issues.",
      "shortDescription": "Set up real-time communication with SignalR hubs",
      "category": "aspnet-web",
      "author": "dotnet-community",
      "triggers": ["signalr", "real-time", "websocket", "hub"],
      "complexity": "intermediate",
      "license": "MIT",
      "platforms": ["windows", "macos", "linux"],
      "tags": ["signalr", "realtime", "websocket", "hub", "messaging"],
      "source": {
        "repo": "https://github.com/serkutYILDIRIM/dotnet-skills-hub",
        "repoName": "serkutYILDIRIM/dotnet-skills-hub",
        "path": "skills/signalr-realtime-setup",
        "skillFile": "SKILL.md",
        "branch": "main"
      }
    },
    {
      "id": "ef-core-migrations",
      "name": "Entity Framework Core Migrations",
      "description": "Manage database schema changes with EF Core migrations. Learn to create, apply, and rollback migrations, handle migration conflicts, seed data, use code-first and database-first approaches, and maintain migrations across multiple environments and teams.",
      "shortDescription": "Manage database schemas with EF Core migrations",
      "category": "ef-data",
      "author": "dotnet-community",
      "triggers": ["ef core", "migrations", "database", "schema"],
      "complexity": "intermediate",
      "featured": true,
      "license": "MIT",
      "platforms": ["windows", "macos", "linux"],
      "tags": ["ef-core", "migrations", "database", "schema", "code-first"],
      "source": {
        "repo": "https://github.com/serkutYILDIRIM/dotnet-skills-hub",
        "repoName": "serkutYILDIRIM/dotnet-skills-hub",
        "path": "skills/ef-core-migrations",
        "skillFile": "SKILL.md",
        "branch": "main"
      }
    },
    {
      "id": "ef-core-query-performance",
      "name": "EF Core Query Performance",
      "description": "Optimize Entity Framework Core queries for maximum performance. Learn to use AsNoTracking, eager loading with Include, projection with Select, avoid N+1 queries, analyze query plans, use compiled queries, and leverage split queries for collections.",
      "shortDescription": "Optimize EF Core queries and avoid performance pitfalls",
      "category": "ef-data",
      "author": "dotnet-community",